{
  "version": 1,
  "schemaId": "https://rosevear.ai/contracts/devil-n-dove.supplier-inventory.v1.schema.json",
  "target": "devil-n-dove",
  "adapterContract": "devil-n-dove.supplier-inventory.v1",
  "contractVersion": 1,
  "packageId": "integration-package-d73e9832",
  "replayKey": "devil-n-dove::integration-package-d73e9832::c7d5b722",
  "batchId": "integration-batch-fixture-devil",
  "approvedAt": "2026-10-06T13:00:00.000Z",
  "sourceDatasetUpdatedAt": "2026-10-06T12:00:00.000Z",
  "generatedAt": "2026-10-06T13:05:00.000Z",
  "expiresAt": "2026-10-07T13:05:00.000Z",
  "fingerprint": "c7d5b722",
  "operations": [
    {
      "action": "update",
      "integrationKey": "devil-supplier::fixture-resin",
      "values": {
        "supplierName": "Fixture Supplier",
        "productName": "UV Resin",
        "supplierSku": "RES-001",
        "packagePriceCad": 29.99,
        "packageQuantity": 1,
        "stockUnit": "bottle",
        "usageUnit": "millilitre",
        "usageUnitsPerStockUnit": 250,
        "totalUsageUnits": 250,
        "costPerUsageUnitCad": 0.11996,
        "sourceUrl": "https://example.test/resin",
        "retrievedAt": "2026-10-06T12:00:00.000Z"
      },
      "sourceEvidence": {
        "sourceUrl": "https://example.test/resin",
        "retrievedAt": "2026-10-06T12:00:00.000Z"
      }
    }
  ]
}
